id,question_code,question_text_en,question_text_hi,question_text_ta,skill_id,weight,group_id,prerequisite_qid
649,AQ25_F1_Q001,I am curious about learning more about myself.,,,2,1,,
650,AQ25_F1_Q002,I like thinking about what my strengths and interests might be.,,,2,1,,
651,AQ25_F1_Q003,I enjoy reflecting on what suits me best.,,,2,1,,
652,AQ25_F1_Q004,I rarely think about learning more about myself.,,,2,1,,
653,AQ25_F1_Q005,I don??????t feel interested in understanding myself better.,,,2,1,,
654,AQ25_F1_Q006,I pay attention to how my actions affect group work.,,,2,1,,
655,AQ25_F2_Q001,I am open to many possible futures for myself.,,,2,1,,
656,AQ25_F2_Q002,I like thinking about different future options.,,,2,1,,
657,AQ25_F2_Q003,I am comfortable considering multiple future paths.,,,2,1,,
658,AQ25_F2_Q004,I prefer having only one clear future option in mind.,,,2,1,,
659,AQ25_F2_Q005,I feel uneasy thinking about different future possibilities.,,,2,1,,
660,AQ25_F2_Q006,I adjust how I communicate based on others?????? responses.,,,2,1,,
661,AQ25_F3_Q001,I like learning about different paths I could take in the future.,,,2,1,,
662,AQ25_F3_Q002,I am curious about various options available to me.,,,2,1,,
663,AQ25_F3_Q003,I seek information to understand different future possibilities.,,,2,1,,
664,AQ25_F3_Q004,I don??????t usually look for information about future options.,,,2,1,,
665,AQ25_F3_Q005,I avoid learning about different future paths.,,,2,1,,
666,AQ25_F4_Q001,I am willing to try different options to see what suits me.,,,2,1,,
667,AQ25_F4_Q002,I like exploring options through experience.,,,2,1,,
668,AQ25_F4_Q003,I try different activities to understand my interests.,,,2,1,,
669,AQ25_F4_Q004,I prefer not to try new options.,,,2,1,,
670,AQ25_F4_Q005,I avoid experimenting with different possibilities.,,,2,1,,
671,AQ25_F5_Q001,I am comfortable not having my future fully planned.,,,2,1,,
672,AQ25_F5_Q002,I am okay with exploring my future over time.,,,2,1,,
673,AQ25_F5_Q003,I don??????t feel rushed to decide my future right now.,,,2,1,,
674,AQ25_F5_Q004,I feel uncomfortable when my future feels uncertain.,,,2,1,,
675,AQ25_F5_Q005,I need clear future plans to feel comfortable.,,,2,1,,
